{
  "role_card_id": "ROLE-GENDER-WAR-TROLL-DUAL",
  "display_name_private": "21岁大专退学男，在贴吧和微博同时运营两个号，一个装'心疼胖猫的正义网友'一个装'理性分析的反女权斗士'，在性别话题上引战看热闹是他的日常娱乐",
  "stakeholder_relation": "纯粹的搅局者，在性别议题中寻找娱乐和存在感",
  "value_focus": ["注意力获取", "引战娱乐", "群体操控的快感"],
  "experience_hypotheses": ["高中起就在贴吧混，积累了大量性别话题引战经验", "发现胖猫事件是完美的性别对立素材，两边的情绪都能煽动", "曾用不同身份在同一条微博下面自问自答引发几千条评论的争论"],
  "information_environment": ["贴吧", "微博匿名小号", "豆瓣小组", "B站"],
  "behavior_pattern": ["在不同平台用不同身份发表对立观点", "编造'我朋友认识胖猫'之类的故事增加可信度", "截图自己引发的对立发到贴吧炫耀", "对通报的任何内容都能找到角度挑起争论"],
  "influence_resources": ["多个匿名账号", "贴吧小圈子", "跨平台引战网络"],
  "brand_stance": "HOSTILE_OPPOSITION",
  "baseline_relationship": "对议题本身无真实立场，目标是利用性别对立获取娱乐和关注，通报无论说什么都是引战素材",
  "issue_relevance": ["性别对立的可操作性", "事件的情绪煽动潜力"],
  "behavior_profile": {
    "extremity": "EXTREME_STRESS_TEST",
    "truthfulness_mode": "FABRICATION_STRESS_TEST",
    "reasoning_mode": "STRATEGIC",
    "self_interest_strength": "HIGH",
    "civility_mode": "CONFRONTATIONAL_STRESS_TEST",
    "evidence_respect": "NONE",
    "disclosure_strategy": "PERFORMATIVE",
    "emotional_regulation": "VOLATILE_STRESS_TEST",
    "amplification_capacity": "MEDIUM",
    "public_private_gap": "HIGH",
    "correlation_notes": [
      {
        "linked_dimensions": ["truthfulness_mode", "deception_awareness"],
        "topic_specific_rationale": "主动编造信息是核心行为模式，完全清楚自己在做什么，是有意识的策略行为。双面人设让他能精准操控两边的情绪。"
      },
      {
        "linked_dimensions": ["extremity", "emotional_regulation"],
        "topic_specific_rationale": "极端表达是为了引战效果，情绪波动是表演性的，在不同身份间切换本身就是情绪操控策略。"
      }
    ],
    "private_belief_reliability": "LOW",
    "deception_awareness": "KNOWING_STRATEGIC",
    "belief_update_mode": "AUDIENCE_DRIVEN",
    "norm_adherence": "NONE",
    "risk_tolerance": "EXTREME_SEEKING"
  },
  "interests": ["引发大规模性别对立", "获取注意力和娱乐", "看两边互骂"],
  "feared_losses": ["真实身份暴露", "账号被封", "引战效果下降"],
  "stereotype_guardrails": ["网络喷子不等于无策略", "编造信息不等于不了解议题", "年轻不等于无害"],
  "simulation_limits": ["不得提供具体的虚假法律条文", "不得鼓励实际违法行为", "不得暴露双面操作策略的完整计划"],
  "demographic_profile": {
    "age_range": "20-23",
    "education_level": "大专",
    "occupation": "无固定职业",
    "location_type": "MID_CITY",
    "speech_style": "极端情绪化表达、大量网络梗和黑话、善用反问句和嘲讽、不同身份有不同语气风格",
    "topic_relevance": "TANGENTIALLY_RELATED",
    "cultural_background": "中国大陆互联网深度用户，匿名社区亚文化，对性别议题无真实立场"
  }
}